<?xml version="1.0" encoding="UTF-8"?>
<pp:Resources 
	xmlns:pp="http://www.processpuzzle.com/ResourceBundle" 
	xmlns:xsi="http://www.w3.org/2001/XMLSchema-instance" 
	xsi:schemaLocation="http://www.processpuzzle.com/ResourceBundle http://www.processpuzzle.com/Schemas/ResourceBundle.xsd ">

  <Resource key="CloseActiveDocumentCommand" type="String">Close</Resource>
  <Resource key="Print" type="String">Print</Resource>
  <Resource key="Save" type="String">Save</Resource>
  <Resource key="Cancel" type="String">Cancel</Resource>
  <Resource key="ShowEditSelectedDocument" type="String">Show document</Resource>
  <Resource key="CreateNewDocument" type="String">Create new document</Resource>
  <Resource key="DeleteSelectedDocument" type="String">Delete document</Resource>

  <Resource key="res_1" type="String">Resource one</Resource>
  <Language name="en">
    <Resource key="res_2" type="String">Resource two</Resource>
  </Language>
  <Language name="hu">
    <Resource key="Print" type="String">Nyomtatás</Resource>
    <Resource key="Save" type="String">Mentés</Resource>
    <Resource key="Cancel" type="String">Mégsem</Resource>
    <Resource key="res_3" type="String">Erőforrás három</Resource>
    <Country name="HU">
      <Resource key="res_4" type="String">Erőforrás négy</Resource>
    </Country>
  </Language>
</pp:Resources>
