<?xml version="1.0" encoding="UTF-8"?>
<!-- This file contains internalization resources for Desktop Configurator. -->
<pp:Resources 
	xmlns:pp="http://www.processpuzzle.com/ResourceBundle" 
	xmlns:xsi="http://www.w3.org/2001/XMLSchema-instance" 
	xsi:schemaLocation="http://www.processpuzzle.com/ResourceBundle http://www.processpuzzle.com/Schemas/ResourceBundle.xsd ">

  <Language name="en">
    <Resource key="DesktopConfigurator.desktopTitle" type="String">ProcessPuzzle</Resource>
    <Resource key="DesktopConfigurator.desktopSubTitle" type="String">Workflow and Content Management Business Platform</Resource>
    <Resource key="DesktopConfigurator.navigationBar" type="String">Navigation Bar</Resource>
    <Resource key="DesktopConfigurator.footerText" type="String">Powered by ProcessPuzzle - Copyright 2005-2011, IT Codex Llc.</Resource>
    <Resource key="DesktopConfigurator.Panel.contentBrowserTitle" type="String">Content Browser</Resource>
    <Resource key="DesktopConfigurator.Panel.documentsTitle" type="String">Documents</Resource>
    <Resource key="DesktopConfigurator.Panel.consoleTitle" type="String">Console</Resource>
    <Resource key="DesktopConfigurator.Panel.menusTitle" type="String">Menus</Resource>
    <Resource key="DesktopConfigurator.Panel.tipsTitle" type="String">Tips</Resource>
    <Resource key="DesktopConfigurator.Panel.whoIsIn" type="String">Who is in?</Resource>

    <Resource key="HierarchicalMenuWidget.documentExamples" type="String">Smart Document</Resource>
    <Resource key="HierarchicalMenuWidget.documentExamples.htmlContent" type="String">HTML Content</Resource>
    <Resource key="HierarchicalMenuWidget.documentExamples.staticDocument" type="String">Static Document</Resource>
    <Resource key="HierarchicalMenuWidget.documentExamples.dynamicDocument" type="String">Dynamic Document</Resource>
    <Resource key="HierarchicalMenuWidget.documentExamples.photoAlbum" type="String">Photo Album</Resource>
    <Resource key="HierarchicalMenuWidget.documentExamples.videoAlbum" type="String">Video Album</Resource>

    <Resource key="HierarchicalMenuWidget.administration" type="String">Administration</Resource>
    <Resource key="HierarchicalMenuWidget.administration.users" type="String">Users</Resource>
    
    <Resource key="LanguageSelectorWidget.en" type="String">English</Resource>
    <Resource key="LanguageSelectorWidget.hu" type="String">Hungarian</Resource>
    <Resource key="LanguageSelectorWidget.select" type="String">Choose language:</Resource>

    <Resource key="SkinSelectorWidget.select" type="String">Choose skin:</Resource>
    
    <Resource key="DocumentComments.introduction" type="String">Comments of the active document.</Resource>
    <Resource key="DocumentComments.title" type="String">Comments</Resource>
    
    <Resource key="DocumentEditorToolBar.alignCenter" type="String">Center</Resource>
    <Resource key="DocumentEditorToolBar.alignJustify" type="String">Justify</Resource>
    <Resource key="DocumentEditorToolBar.alignLeft" type="String">Left</Resource>
    <Resource key="DocumentEditorToolBar.alignRight" type="String">Right</Resource>
    
    <Resource key="DocumentProperties.introduction" type="String">Properties of the active document.</Resource>
    <Resource key="DocumentProperties.title" type="String">Document Properties</Resource>
    <Resource key="DocumentProperties.properties.uri" type="String">uri:</Resource>
    <Resource key="DocumentProperties.properties.title" type="String">title:</Resource>
    <Resource key="DocumentProperties.properties.subject" type="String">subject:</Resource>
    <Resource key="DocumentProperties.properties.created" type="String">created:</Resource>
    <Resource key="DocumentProperties.properties.lastModified" type="String">last modified:</Resource>
    
    <Resource key="DynamicDocument.exampleDescription" type="String">The list below is the content of an RSS.xml content source. As the item is a repeated element, more than one news is displayed.</Resource>
    <Resource key="DynamicDocument.footer" type="String">ProcessPuzzle - Desktop like back-end agnostic browser interface</Resource>
    <Resource key="DynamicDocument.introduction" type="String">This example - SmartDocument - retrieves it's content from content xml file. If specified, recurring content elements are repeated automatically.
    The content elements can be edited, modified. Internationalization happens with selecting different language versions of content xml file.</Resource>
    <Resource key="DynamicDocument.itemsTitle" type="String">News:</Resource>
    <Resource key="DynamicDocument.subTitle" type="String">Smart Document Example</Resource>
    <Resource key="DynamicDocument.title" type="String">Dynamic Document</Resource>
    <Resource key="DynamicDocument.RSS.link" type="String">link: </Resource>
    <Resource key="DynamicDocument.RSS.description" type="String">description: </Resource>
    <Resource key="DynamicDocument.RSS.language" type="String">language: </Resource>
    <Resource key="DynamicDocument.RSS.pubDate" type="String">publicated: </Resource>
    <Resource key="DynamicDocument.RSS.lastBuildDate" type="String">genarated: </Resource>
    <Resource key="DynamicDocument.RSS.docs" type="String">url: </Resource>
    <Resource key="DynamicDocument.RSS.generator" type="String">generator: </Resource>
    <Resource key="DynamicDocument.RSS.managingEditor" type="String">managing editor: </Resource>
    <Resource key="DynamicDocument.RSS.webMaster" type="String">webmaster: </Resource>
    
    <Resource key="StaticDocument.exampleDescription" type="String">All of this document's elements are examples to display static content.</Resource>
    <Resource key="StaticDocument.footer" type="String">ProcessPuzzle - Desktop like back-end agnostic browser interface</Resource>
    <Resource key="StaticDocument.introduction" type="String">This example - SmartDocument - contains only static elements defined in the definition xml. 
    As there is no editable values in this document the definition doesn't refers to any content xml. 
    Text values in the definition xml are automatically translated. This features facilitates of creating document templates.</Resource>
    <Resource key="StaticDocument.subTitle" type="String">Smart Document Example</Resource>
    <Resource key="StaticDocument.title" type="String">Static Document</Resource>
    
    <Resource key="PersonalToDoList.introduction" type="String">To Do list of the logged in user.</Resource>
    <Resource key="PersonalToDoList.title" type="String">Personal To Do List</Resource>
    
    <Resource key="PhotoGaleryDocument.title" type="String">Dokumentum beépülő modullal</Resource>
    <Resource key="PhotoGaleryDocument.introduction" type="String">Egy okos dokumentumba tetszőleges számú modul építhető be. A beépülő modulok többnyire speciális módon jelenítenek meg tartamat.</Resource>
    <Resource key="PhotoGaleryDocument.exampleDescription" type="String">A lenti példa egy slide show modul bepítését szemlélteti.</Resource>
    <Resource key="PhotoGaleryDocument.footer" type="String">ProcessPuzzle - Windows szerű, háttér rendszer független, böngészős felhasználói felület</Resource>
    <Resource key="PhotoGaleryDocument.subTitle" type="String">Okos dokumentum példa</Resource>
    
  </Language>
</pp:Resources>
