<?xml version="1.0" encoding="UTF-8"?>
<pp:Resources 
	xmlns:pp="http://www.processpuzzle.com/ResourceBundle" 
	xmlns:xsi="http://www.w3.org/2001/XMLSchema-instance" 
	xsi:schemaLocation="http://www.processpuzzle.com/ResourceBundle http://www.processpuzzle.com/Schemas/ResourceBundle.xsd ">

  <Language name="en">
    <Resource key="SmartDocument.headerText" type="String">Sample Smart Document</Resource>
    <Resource key="SmartDocument.itemsTitle" type="String">Items</Resource>
    <Resource key="SmartDocument.copyright" type="String">Copyright IT Codex Llc.</Resource>
  </Language>

  <Language name="hu">
    <Resource key="SmartDocument.headerText" type="String">Okos dokumentum</Resource>
    <Resource key="SmartDocument.itemsTitle" type="String">Element</Resource>
    <Resource key="SmartDocument.copyright" type="String">Minden jog fenntartva, IT Kódex Kft.</Resource>
  </Language>
</pp:Resources>
